{
  "$id": "https://value-story.local/value-case.schema.json",
  "$schema": "https://json-schema.org/draft/2020-12/schema",
  "type": "object",
  "required": ["schema_version", "meta", "initiative", "drivers", "arc", "claims", "evidence"],
  "additionalProperties": false,
  "properties": {
    "schema_version": { "const": 1 },
    "meta": {
      "type": "object",
      "required": ["title", "period"],
      "additionalProperties": false,
      "properties": {
        "title": { "type": "string", "minLength": 1 },
        "owner": { "type": "string" },
        "period": { "$ref": "common.schema.json#/$defs/period" },
        "quality_profile": { "type": "string", "enum": ["draft", "showcase"] },
        "motion": { "type": "string", "enum": ["static", "entry"] }
      }
    },
    "initiative": {
      "type": "object",
      "required": ["id", "name"],
      "additionalProperties": false,
      "properties": {
        "id": { "type": "string", "minLength": 1 },
        "name": { "type": "string", "minLength": 1 },
        "sponsor": { "type": "string" },
        "function": { "type": "string" },
        "status": { "type": "string", "enum": ["poc", "pilot", "live", "retired"] }
      }
    },
    "drivers": {
      "type": "object",
      "required": ["primary"],
      "additionalProperties": false,
      "properties": {
        "primary": { "$ref": "common.schema.json#/$defs/driver" },
        "secondary": {
          "type": "array",
          "items": { "$ref": "common.schema.json#/$defs/driver" },
          "uniqueItems": true
        }
      }
    },
    "arc": {
      "type": "object",
      "required": ["problem", "capability", "outcome", "significance"],
      "additionalProperties": false,
      "properties": {
        "problem": { "$ref": "common.schema.json#/$defs/prose_chapter" },
        "capability": { "$ref": "common.schema.json#/$defs/prose_chapter" },
        "significance": { "$ref": "common.schema.json#/$defs/prose_chapter" },
        "outcome": {
          "type": "object",
          "required": ["headline", "claim_refs"],
          "additionalProperties": false,
          "properties": {
            "headline": { "type": "string", "minLength": 1 },
            "claim_refs": {
              "type": "array",
              "minItems": 1,
              "items": { "$ref": "common.schema.json#/$defs/ref" }
            }
          }
        }
      }
    },
    "claims": {
      "type": "array",
      "minItems": 1,
      "items": {
        "type": "object",
        "required": ["id", "driver", "tier"],
        "additionalProperties": false,
        "properties": {
          "id": { "type": "string", "minLength": 1 },
          "driver": { "$ref": "common.schema.json#/$defs/driver" },
          "tier": { "type": "string", "enum": ["measured", "estimated", "qualitative"] },
          "metric": { "type": "string", "minLength": 1 },
          "unit": { "type": "string", "minLength": 1 },
          "direction": { "type": "string", "enum": ["increase", "decrease"] },
          "baseline": { "$ref": "common.schema.json#/$defs/point" },
          "current": { "$ref": "common.schema.json#/$defs/point" },
          "statement": { "type": "string", "minLength": 1 },
          "evidence_ref": { "$ref": "common.schema.json#/$defs/ref" },
          "assumption": {
            "type": "object",
            "required": ["statement", "owner"],
            "additionalProperties": false,
            "properties": {
              "statement": { "type": "string", "minLength": 1 },
              "owner": { "type": "string", "minLength": 1 }
            }
          }
        },
        "allOf": [
          {
            "if": { "properties": { "tier": { "const": "measured" } }, "required": ["tier"] },
            "then": {
              "properties": { "metric": {}, "unit": {}, "direction": {}, "baseline": {}, "current": {} },
              "required": ["metric", "unit", "direction", "baseline", "current"]
            }
          },
          {
            "if": { "properties": { "tier": { "const": "estimated" } }, "required": ["tier"] },
            "then": {
              "properties": { "metric": {}, "unit": {}, "direction": {}, "baseline": {}, "current": {}, "assumption": {} },
              "required": ["metric", "unit", "direction", "baseline", "current", "assumption"]
            }
          },
          {
            "if": { "properties": { "tier": { "const": "qualitative" } }, "required": ["tier"] },
            "then": {
              "properties": { "statement": {} },
              "required": ["statement"],
              "not": { "anyOf": [
                { "properties": { "baseline": {} }, "required": ["baseline"] },
                { "properties": { "current": {} }, "required": ["current"] },
                { "properties": { "unit": {} }, "required": ["unit"] },
                { "properties": { "direction": {} }, "required": ["direction"] }
              ] }
            }
          }
        ]
      }
    },
    "evidence": {
      "type": "array",
      "minItems": 1,
      "items": {
        "type": "object",
        "required": ["ref", "kind", "title", "date"],
        "additionalProperties": false,
        "properties": {
          "ref": { "$ref": "common.schema.json#/$defs/ref" },
          "kind": { "type": "string", "enum": ["doc", "email", "dataset", "interview"] },
          "title": { "type": "string", "minLength": 1 },
          "author": { "type": "string" },
          "date": { "$ref": "common.schema.json#/$defs/date" },
          "locator": { "type": "string" },
          "quote": { "type": "string" }
        }
      }
    }
  }
}
