{
  "schema_version": 1,
  "meta": { "title": "Claims Backlog Clearance", "owner": "R. Okafor", "period": "2026-07",
            "quality_profile": "showcase", "motion": "entry" },
  "initiative": { "id": "int-02", "name": "Claims Backlog Clearance", "sponsor": "D. Marsh",
                  "function": "Operations", "status": "live" },
  "drivers": { "primary": "process-cost-efficiency",
               "secondary": ["productivity", "governance-oversight"] },
  "arc": {
    "problem": {
      "headline": "Backlogged claims sat untouched for weeks",
      "detail": "Adjusters worked oldest-first with no way to separate simple claims from complex ones, so simple claims waited behind complex ones.",
      "evidence_refs": ["e1"]
    },
    "capability": {
      "headline": "Claims sort themselves by complexity on intake",
      "detail": "A classifier reads the claim file at submission and routes it to the queue suited to its complexity.",
      "evidence_refs": ["e2"],
      "novelty": "first-of-kind"
    },
    "outcome": {
      "headline": "The backlog stopped growing and started shrinking",
      "claim_refs": ["c1", "c2", "c3", "c4"]
    },
    "significance": {
      "headline": "Adjuster time now goes to the claims that need it",
      "detail": "Simple claims clear in days, freeing senior adjusters for the complex ones that actually require judgment."
    }
  },
  "claims": [
    { "id": "c1", "driver": "process-cost-efficiency", "metric": "claim cycle time",
      "unit": "days", "tier": "measured", "direction": "decrease",
      "baseline": { "value": 21, "asof": "2026-01", "evidence_ref": "e3" },
      "current":  { "value": 4,  "asof": "2026-07", "evidence_ref": "e3" } },
    { "id": "c2", "driver": "process-cost-efficiency", "metric": "open claims backlog",
      "unit": "claims", "tier": "measured", "direction": "decrease",
      "baseline": { "value": 3400, "asof": "2026-01", "evidence_ref": "e4" },
      "current":  { "value": 620,  "asof": "2026-07", "evidence_ref": "e4" } },
    { "id": "c3", "driver": "productivity", "metric": "claims closed per adjuster",
      "unit": "claims/week", "tier": "measured", "direction": "increase",
      "baseline": { "value": 18, "asof": "2026-01", "evidence_ref": "e5" },
      "current":  { "value": 47, "asof": "2026-07", "evidence_ref": "e5" } },
    { "id": "c4", "driver": "governance-oversight", "metric": "misrouted claims",
      "unit": "claims/month", "tier": "measured", "direction": "decrease",
      "baseline": { "value": 240, "asof": "2026-01", "evidence_ref": "e6" },
      "current":  { "value": 11,  "asof": "2026-07", "evidence_ref": "e6" } }
  ],
  "evidence": [
    { "ref": "e1", "kind": "doc", "title": "Backlog audit", "author": "Ops Analytics",
      "date": "2026-01-10", "locator": "page 3" },
    { "ref": "e2", "kind": "doc", "title": "Classifier design note", "author": "Eng",
      "date": "2026-02-18", "locator": "page 1" },
    { "ref": "e3", "kind": "dataset", "title": "Claim cycle time log", "author": "Ops Analytics",
      "date": "2026-07-31", "locator": "cycle_time_weekly" },
    { "ref": "e4", "kind": "dataset", "title": "Backlog snapshot history", "author": "Ops Analytics",
      "date": "2026-07-31", "locator": "backlog_snapshot" },
    { "ref": "e5", "kind": "dataset", "title": "Adjuster throughput log", "author": "Ops Analytics",
      "date": "2026-07-31", "locator": "throughput_weekly" },
    { "ref": "e6", "kind": "dataset", "title": "Routing exception log", "author": "Quality team",
      "date": "2026-07-28", "locator": "routing_exceptions" }
  ]
}
