{
  "schema_version": 1,
  "meta": { "title": "Intake Triage", "owner": "J. Hao", "period": "2026-08",
            "quality_profile": "showcase", "motion": "entry" },
  "initiative": { "id": "int-01", "name": "Intake Triage", "sponsor": "S. Tzou",
                  "function": "Operations", "status": "live" },
  "drivers": { "primary": "labor-cost-efficiency",
               "secondary": ["productivity", "governance-oversight"] },
  "arc": {
    "problem": {
      "headline": "Intake took three days before anyone looked at it",
      "detail": "Every case was triaged by hand against a rota that could not flex with volume.",
      "evidence_refs": ["e1"]
    },
    "capability": {
      "headline": "Cases classify themselves on arrival",
      "detail": "Routing and priority are assigned at ingestion, with the rationale recorded.",
      "evidence_refs": ["e2"],
      "novelty": "first-of-kind"
    },
    "outcome": {
      "headline": "Three days became one morning",
      "claim_refs": ["c1", "c2", "c3"]
    },
    "significance": {
      "headline": "Capacity that grows without headcount",
      "detail": "Volume can double without a proportional increase in reviewer cost."
    }
  },
  "claims": [
    { "id": "c1", "driver": "labor-cost-efficiency", "metric": "case turnaround time",
      "unit": "hours", "tier": "measured", "direction": "decrease",
      "baseline": { "value": 72, "asof": "2026-01", "evidence_ref": "e3" },
      "current":  { "value": 9,  "asof": "2026-08", "evidence_ref": "e3" } },
    { "id": "c2", "driver": "productivity", "metric": "reviewer capacity",
      "unit": "cases/week", "tier": "estimated", "direction": "increase",
      "baseline": { "value": 40, "asof": "2026-01" },
      "current":  { "value": 55, "asof": "2026-08" },
      "assumption": { "statement": "assumes steady case mix across both periods",
                      "owner": "M. Behbahani" } },
    { "id": "c3", "driver": "governance-oversight", "tier": "qualitative",
      "statement": "every routing decision now carries an auditable rationale trail",
      "evidence_ref": "e4" }
  ],
  "evidence": [
    { "ref": "e1", "kind": "doc", "title": "Operations review", "author": "Ops",
      "date": "2026-01-15", "locator": "page 2" },
    { "ref": "e2", "kind": "doc", "title": "Triage design note", "author": "Eng",
      "date": "2026-03-02", "locator": "page 1" },
    { "ref": "e3", "kind": "dataset", "title": "Triage timings", "author": "Ops",
      "date": "2026-08-30", "locator": "triage_daily" },
    { "ref": "e4", "kind": "email", "title": "Reviewer feedback", "author": "Review team",
      "date": "2026-08-12", "locator": "message 88" }
  ]
}
