{
  "schema_version": 1,
  "meta": {
    "title": "Continuous Commissioning",
    "owner": "K. Lindqvist",
    "period": "2026-08",
    "quality_profile": "showcase",
    "motion": "entry"
  },
  "initiative": {
    "id": "cx-01",
    "name": "Continuous Commissioning",
    "sponsor": "Head of Property Operations",
    "function": "Real Estate & Facilities",
    "status": "live"
  },
  "drivers": {
    "primary": "overhead-cost-efficiency",
    "secondary": ["operational-adaptability", "governance-oversight", "productivity"]
  },
  "arc": {
    "problem": {
      "headline": "Faults were found by occupants, not by engineers",
      "detail": "Across the managed estate, HVAC plant drifted out of tune between annual commissioning visits. A stuck damper or an overridden setpoint went unnoticed until someone complained about a cold floor, by which point the plant had been burning energy against itself for weeks. Engineers spent their time reacting to tickets rather than tuning buildings.",
      "evidence_refs": ["e1", "e2"]
    },
    "capability": {
      "headline": "Every building is now commissioned continuously, not annually",
      "detail": "Telemetry from the building management systems is read against expected operating envelopes, so simultaneous heating and cooling, stuck actuators and stale overrides surface as ranked findings with a recommended correction. Engineers open a morning queue of what actually needs attention instead of a list of what someone reported.",
      "evidence_refs": ["e3"],
      "novelty": "reusable"
    },
    "outcome": {
      "headline": "Buildings now tell us they are wrong before anyone feels it",
      "claim_refs": ["c1", "c2", "c3", "c4"]
    },
    "significance": {
      "headline": "One engineer now covers what a team of engineers used to walk",
      "detail": "The same detection service runs against any site whose plant is already instrumented, so adding a building to the programme is a configuration change rather than a new engagement. Energy performance stops decaying between visits, which is what makes the savings hold rather than appear once and erode.",
      "evidence_refs": ["e4"]
    }
  },
  "claims": [
    {
      "id": "c1",
      "driver": "overhead-cost-efficiency",
      "metric": "HVAC energy intensity",
      "unit": "kWh/m2/yr",
      "tier": "measured",
      "direction": "decrease",
      "baseline": { "value": 148, "asof": "2025-09", "evidence_ref": "e5" },
      "current": { "value": 119, "asof": "2026-08", "evidence_ref": "e5" }
    },
    {
      "id": "c2",
      "driver": "operational-adaptability",
      "metric": "time to detect a plant fault",
      "unit": "hours",
      "tier": "measured",
      "direction": "decrease",
      "baseline": { "value": 96, "asof": "2025-09", "evidence_ref": "e6" },
      "current": { "value": 5, "asof": "2026-08", "evidence_ref": "e6" }
    },
    {
      "id": "c3",
      "driver": "productivity",
      "metric": "reactive callouts per building per year",
      "unit": "callouts",
      "tier": "estimated",
      "direction": "decrease",
      "baseline": { "value": 41, "asof": "2025-09" },
      "current": { "value": 26, "asof": "2026-08" },
      "assumption": {
        "statement": "assumes the pilot estate's fault profile is representative of the wider portfolio, and that callout volume scales with detected faults rather than with occupancy",
        "owner": "R. Whitfield, Property Operations"
      }
    },
    {
      "id": "c4",
      "driver": "governance-oversight",
      "tier": "qualitative",
      "statement": "Every setpoint change now carries the finding that prompted it, the engineer who accepted it, and a one-click reversal path",
      "evidence_ref": "e3"
    }
  ],
  "evidence": [
    {
      "ref": "e1",
      "kind": "doc",
      "title": "Estate condition review",
      "author": "Property Operations",
      "date": "2025-10-14",
      "locator": "section 3, plant performance"
    },
    {
      "ref": "e2",
      "kind": "email",
      "title": "Recurring comfort complaints, north campus",
      "author": "Facilities helpdesk",
      "date": "2025-11-03",
      "locator": "thread summary"
    },
    {
      "ref": "e3",
      "kind": "doc",
      "title": "Continuous commissioning design note",
      "author": "Engineering",
      "date": "2026-01-22",
      "locator": "pages 2 to 5"
    },
    {
      "ref": "e4",
      "kind": "interview",
      "title": "Regional engineering manager debrief",
      "author": "Property Operations",
      "date": "2026-08-19",
      "locator": "rollout readiness"
    },
    {
      "ref": "e5",
      "kind": "dataset",
      "title": "BMS metered consumption, weather-normalised",
      "author": "Energy team",
      "date": "2026-08-31",
      "locator": "bms_energy_monthly"
    },
    {
      "ref": "e6",
      "kind": "dataset",
      "title": "CMMS work order extract",
      "author": "Property Operations",
      "date": "2026-08-31",
      "locator": "wo_fault_detect"
    }
  ]
}
